[
  {
    "card_id": "card.paper.lagrangian-cmdp-101",
    "subject_ref": "lit.altman-1999-cmdp",
    "title": "Constrained MDPs (Altman 1999)",
    "innovation": "Foundational LP formulation of constrained Markov decision processes over occupation measures.",
    "definition": "maximize discounted reward subject to discounted cost constraints over the occupancy polytope.",
    "evaluation": "Canonical basis for option-(b) discounted-cost constraints; linear, well understood.",
    "created_at": "2026-09-06T01:00:00Z"
  }
]
